{
  "observation_id": "O-0123456789ab",
  "import_sha256": "4444444444444444444444444444444444444444444444444444444444444444",
  "case_id": "TC-042",
  "case_sha256": "1111111111111111111111111111111111111111111111111111111111111111",
  "result": "PASS",
  "run_id": "RUN-2026-09-16-001",
  "base_url": "https://staging.example.com:8443",
  "account": "qa-security-1",
  "head_oid": "1111111111111111111111111111111111111111"
}
